{
  "schemaVersion": 1,
  "old": {
    "uniqueName": "PowerOpsSeed",
    "version": "1.0.0.0"
  },
  "new": {
    "uniqueName": "PowerOpsSeed",
    "version": "1.0.0.0"
  },
  "changes": [
    {
      "kind": "added",
      "component": "connectionReference",
      "key": "pops_SpareDataverse",
      "risks": [
        "connection-reference"
      ]
    },
    {
      "kind": "changed",
      "component": "workflow",
      "key": "4c8dd007-dfcb-f111-a05c-0022480697a8",
      "name": "Stamp work item status",
      "detail": "definition changed",
      "risks": []
    }
  ],
  "summary": {
    "added": 1,
    "removed": 0,
    "changed": 1
  }
}
